{
  "$schema": "../schema/team.schema.json",
  "id": "nemesis-claw",
  "name": "Nemesis Claw",
  "faction": "Heretic Astartes",
  "operatives": [
    {
      "name": "Night Lord Visionary",
      "operativeType": "Night Lord Visionary",
      "stats": {
        "move": 6,
        "apl": 3,
        "wounds": 15,
        "save": "3\u002B"
      },
      "weapons": [
        {
          "name": "Bolt pistol",
          "type": "Ranged",
          "atk": 4,
          "hit": "3\u002B",
          "dmg": "3/4",
          "specialRules": "\u0007Range 8\u0022"
        },
        {
          "name": "Plasma pistol (standard)",
          "type": "Ranged",
          "atk": 4,
          "hit": "3\u002B",
          "dmg": "3/5",
          "specialRules": "\u0007Range 8\u0022, Piercing 1"
        },
        {
          "name": "Plasma pistol (supercharge)",
          "type": "Ranged",
          "atk": 4,
          "hit": "3\u002B",
          "dmg": "4/5",
          "specialRules": "\u0007Range 8\u0022, Hot, Lethal 5\u002B, Piercing 1"
        },
        {
          "name": "Nostraman chainblade",
          "type": "Melee",
          "atk": 5,
          "hit": "3\u002B",
          "dmg": "4/5",
          "specialRules": "\u0007Rending"
        },
        {
          "name": "Power fist",
          "type": "Melee",
          "atk": 5,
          "hit": "4\u002B",
          "dmg": "5/7",
          "specialRules": "\u0007Brutal"
        },
        {
          "name": "Power maul",
          "type": "Melee",
          "atk": 5,
          "hit": "3\u002B",
          "dmg": "4/6",
          "specialRules": "\u0007Shock"
        },
        {
          "name": "Power weapon",
          "type": "Melee",
          "atk": 5,
          "hit": "3\u002B",
          "dmg": "4/6",
          "specialRules": "\u0007Lethal 5\u002B"
        }
      ],
      "equipment": [
        "Flayed Skin",
        "Chain Snare",
        "Grisly Trophy",
        "Comms Jammers",
        "Portable Barricade",
        "Utility Grenades",
        "Ammo Cache",
        "Razor Wire",
        "Comms Device",
        "Mines",
        "Light Barricades",
        "Heavy Barricade",
        "Ladders",
        "Explosive Grenades",
        "Breaching Charge"
      ]
    },
    {
      "name": "Night Lord Fearmonger",
      "operativeType": "Night Lord Fearmonger",
      "stats": {
        "move": 6,
        "apl": 3,
        "wounds": 14,
        "save": "3\u002B"
      },
      "weapons": [
        {
          "name": "Scoped bolt pistol (long range)",
          "type": "Ranged",
          "atk": 4,
          "hit": "3\u002B",
          "dmg": "3/4",
          "specialRules": "\u0007-"
        },
        {
          "name": "Terrorchem vial",
          "type": "Ranged",
          "atk": 5,
          "hit": "3\u002B",
          "dmg": "2/0",
          "specialRules": "\u0007Range 6\u0022, Blast 2\u0022, Devastating 3, Limited 1, Saturate, Terrorchem*"
        },
        {
          "name": "Tainted blade",
          "type": "Melee",
          "atk": 5,
          "hit": "3\u002B",
          "dmg": "3/5",
          "specialRules": "\u0007Terrorchem*"
        }
      ],
      "equipment": [
        "Flayed Skin",
        "Chain Snare",
        "Grisly Trophy",
        "Comms Jammers",
        "Portable Barricade",
        "Utility Grenades",
        "Ammo Cache",
        "Razor Wire",
        "Comms Device",
        "Mines",
        "Light Barricades",
        "Heavy Barricade",
        "Ladders",
        "Explosive Grenades",
        "Breaching Charge"
      ]
    },
    {
      "name": "Night Lord Gunner",
      "operativeType": "Night Lord Gunner",
      "stats": {
        "move": 6,
        "apl": 3,
        "wounds": 14,
        "save": "3\u002B"
      },
      "weapons": [
        {
          "name": "Bolt pistol",
          "type": "Ranged",
          "atk": 4,
          "hit": "3\u002B",
          "dmg": "3/4",
          "specialRules": "\u0007Range 8\u0022"
        },
        {
          "name": "Flamer",
          "type": "Ranged",
          "atk": 4,
          "hit": "2\u002B",
          "dmg": "3/3",
          "specialRules": "\u0007Range 8\u0022, Saturate, Torrent 2\u0022"
        },
        {
          "name": "Meltagun",
          "type": "Ranged",
          "atk": 4,
          "hit": "3\u002B",
          "dmg": "6/3",
          "specialRules": "\u0007Range 6\u0022, Devastating 4, Piercing 2"
        },
        {
          "name": "Plasma gun (standard)",
          "type": "Ranged",
          "atk": 4,
          "hit": "3\u002B",
          "dmg": "4/6",
          "specialRules": "\u0007Piercing 1"
        },
        {
          "name": "Plasma gun (supercharge)",
          "type": "Melee",
          "atk": 4,
          "hit": "3\u002B",
          "dmg": "5/6",
          "specialRules": "\u0007Hot, Lethal 5\u002B, Piercing 1"
        },
        {
          "name": "Fists",
          "type": "Melee",
          "atk": 4,
          "hit": "3\u002B",
          "dmg": "3/4",
          "specialRules": "\u0007-"
        }
      ],
      "equipment": [
        "Flayed Skin",
        "Chain Snare",
        "Grisly Trophy",
        "Comms Jammers",
        "Portable Barricade",
        "Utility Grenades",
        "Ammo Cache",
        "Razor Wire",
        "Comms Device",
        "Mines",
        "Light Barricades",
        "Heavy Barricade",
        "Ladders",
        "Explosive Grenades",
        "Breaching Charge"
      ]
    },
    {
      "name": "Night Lord Heavy Gunner",
      "operativeType": "Night Lord Heavy Gunner",
      "stats": {
        "move": 6,
        "apl": 3,
        "wounds": 14,
        "save": "3\u002B"
      },
      "weapons": [
        {
          "name": "Bolt pistol",
          "type": "Ranged",
          "atk": 4,
          "hit": "3\u002B",
          "dmg": "3/4",
          "specialRules": "\u0007Range 8\u0022"
        },
        {
          "name": "Heavy bolter (focused)",
          "type": "Ranged",
          "atk": 5,
          "hit": "3\u002B",
          "dmg": "4/5",
          "specialRules": "\u0007Heavy (Reposition only), Piercing Crits 1"
        },
        {
          "name": "Heavy bolter (sweeping)",
          "type": "Ranged",
          "atk": 4,
          "hit": "3\u002B",
          "dmg": "4/5",
          "specialRules": "\u0007Heavy (Reposition only), Piercing Crits 1, Torrent 1\u0022"
        },
        {
          "name": "Missile launcher (frag)",
          "type": "Ranged",
          "atk": 4,
          "hit": "3\u002B",
          "dmg": "3/5",
          "specialRules": "\u0007Blast 2\u0022, Heavy (Reposition only)"
        },
        {
          "name": "Missile launcher (krak)",
          "type": "Ranged",
          "atk": 4,
          "hit": "3\u002B",
          "dmg": "5/7",
          "specialRules": "\u0007Heavy (Reposition only), Piercing 1"
        },
        {
          "name": "Fists",
          "type": "Melee",
          "atk": 4,
          "hit": "3\u002B",
          "dmg": "3/4",
          "specialRules": "\u0007-"
        }
      ],
      "equipment": [
        "Flayed Skin",
        "Chain Snare",
        "Grisly Trophy",
        "Comms Jammers",
        "Portable Barricade",
        "Utility Grenades",
        "Ammo Cache",
        "Razor Wire",
        "Comms Device",
        "Mines",
        "Light Barricades",
        "Heavy Barricade",
        "Ladders",
        "Explosive Grenades",
        "Breaching Charge"
      ]
    },
    {
      "name": "Night Lord Screecher",
      "operativeType": "Night Lord Screecher",
      "stats": {
        "move": 6,
        "apl": 3,
        "wounds": 14,
        "save": "3\u002B"
      },
      "weapons": [
        {
          "name": "Lightning claws",
          "type": "Melee",
          "atk": 5,
          "hit": "3\u002B",
          "dmg": "4/5",
          "specialRules": "\u0007Ceaseless, Lethal 5\u002B"
        }
      ],
      "equipment": [
        "Flayed Skin",
        "Chain Snare",
        "Grisly Trophy",
        "Comms Jammers",
        "Portable Barricade",
        "Utility Grenades",
        "Ammo Cache",
        "Razor Wire",
        "Comms Device",
        "Mines",
        "Light Barricades",
        "Heavy Barricade",
        "Ladders",
        "Explosive Grenades",
        "Breaching Charge"
      ]
    },
    {
      "name": "Night Lord Skinthief",
      "operativeType": "Night Lord Skinthief",
      "stats": {
        "move": 6,
        "apl": 3,
        "wounds": 14,
        "save": "3\u002B"
      },
      "weapons": [
        {
          "name": "Bolt pistol",
          "type": "Ranged",
          "atk": 4,
          "hit": "3\u002B",
          "dmg": "3/4",
          "specialRules": "\u0007Range 8\u0022"
        },
        {
          "name": "Nostraman chainglaive",
          "type": "Melee",
          "atk": 5,
          "hit": "3\u002B",
          "dmg": "4/6",
          "specialRules": "\u0007Rending"
        }
      ],
      "equipment": [
        "Flayed Skin",
        "Chain Snare",
        "Grisly Trophy",
        "Comms Jammers",
        "Portable Barricade",
        "Utility Grenades",
        "Ammo Cache",
        "Razor Wire",
        "Comms Device",
        "Mines",
        "Light Barricades",
        "Heavy Barricade",
        "Ladders",
        "Explosive Grenades",
        "Breaching Charge"
      ]
    },
    {
      "name": "Night Lord Ventrilokar",
      "operativeType": "Night Lord Ventrilokar",
      "stats": {
        "move": 6,
        "apl": 3,
        "wounds": 14,
        "save": "3\u002B"
      },
      "weapons": [
        {
          "name": "Bolt pistol",
          "type": "Ranged",
          "atk": 4,
          "hit": "3\u002B",
          "dmg": "3/4",
          "specialRules": "\u0007Range 8\u0022"
        },
        {
          "name": "Chainsword",
          "type": "Melee",
          "atk": 5,
          "hit": "3\u002B",
          "dmg": "4/5",
          "specialRules": "\u0007-"
        }
      ],